<?xml version="1.0" encoding="UTF-8"?>
<SituationTemplate id="A0"
	xmlns:xsi="http://www.w3.org/2001/XMLSchema-instance"
	xsi:noNamespaceSchemaLocation="situation_template_draft01.xsd"
	name="SystemObservation">
		<operationNode id="B3" name="combine Sensors">
			<type>and</type>
			<parent parentID="B10"/>
			<negated>true</negated>
		</operationNode>
		<conditionNode id="B4" name="% CPU load">
			<type>type</type>
			<measureName>measureName</measureName>
			<opType>greaterThan</opType>
			<condValue>
				<value>70</value>
			</condValue>
			<parent parentID="B3"/>
		</conditionNode>
		<conditionNode id="B8" name="MB RBM free">
			<type>type</type>
			<measureName>measureName</measureName>
			<opType>lowerThan</opType>
			<condValue>
				<value>10</value>
			</condValue>
			<parent parentID="B3"/>
		</conditionNode>
		<conditionNode id="B9" name="StatusCodeChecker">
			<type>type</type>
			<measureName>measureName</measureName>
			<opType>notEquals</opType>
			<condValue>
				<value>200</value>
			</condValue>
			<parent parentID="B3"></parent>
		</conditionNode>
		<contextNode id="B5" name="memorySensor">
			<parent parentID="B8"></parent>
		</contextNode>
		<contextNode id="B7" name ="watchdogSensor">
			<parent parentID="B9"/>
		</contextNode>
		<situationNode name="machine_failed" id="B10"/>

		<operationNode id="A3" name="combine Sensors">
			<type>and</type>
			<parent parentID="A10"/>
			<negated>true</negated>
		</operationNode>
		<conditionNode id="A4" name="% CPU load">
			<type>type</type>
			<measureName>measureName</measureName>
			<opType>greaterThan</opType>
			<condValue>
				<value>70</value>
			</condValue>
			<parent parentID="A3"/>
		</conditionNode>
		<conditionNode id="A8" name="MB RAM free">
			<type>type</type>
			<measureName>measureName</measureName>
			<opType>lowerThan</opType>
			<condValue>
				<value>10</value>
			</condValue>
			<parent parentID="A3"/>
		</conditionNode>
		<conditionNode id="A9" name="StatusCodeChecker">
			<type>type</type>
			<measureName>measureName</measureName>
			<opType>notEquals</opType>
			<condValue>
				<value>200</value>
			</condValue>
			<parent parentID="A3"></parent>
		</conditionNode>
		<contextNode id="A5" name="memorySensor">
			<parent parentID="A8"></parent>
		</contextNode>
		<contextNode id="A6" name="cpuSensor">
			<parent parentID="A4"></parent>
			<parent parentID="B4"></parent>
		</contextNode>
		<contextNode id="A7" name ="watchdogSensor">
			<parent parentID="A9"/>
		</contextNode>
		<situationNode name="machine_failed" id="A10"/>
</SituationTemplate>
