<?xml version="1.0" encoding="UTF-8"?>
<SituationTemplate id="A0"
	xmlns:xsi="http://www.w3.org/2001/XMLSchema-instance"
	xsi:noNamespaceSchemaLocation="situation_template_draft01.xsd"
	name="SystemObservation">
	<Situation id="A1" name="SystemFailure">
		<operationNode id="A6" name="AND">
			<parent parentID="A10" />
			<type>and</type>
			<negated>false</negated>
		</operationNode>
		<conditionNode id="A4" name="% CPU load">
			<type>type</type>
			<measureName>measureName</measureName>
			<opType>lowerThan</opType>
			<condValue>
				<value>10</value>
			</condValue>
			<parent parentID="A6"/>
		</conditionNode>
		<contextNode id="A5" type="distance">
			<parent parentID="A4"/>
		</contextNode>
		<situationNode name="machine_failed" id="A10"/>
	</Situation>
</SituationTemplate>
