<?xml version="1.0" encoding="UTF-8"?>
<SituationTemplate id="A0"
	xmlns:xsi="http://www.w3.org/2001/XMLSchema-instance"
	xsi:noNamespaceSchemaLocation="situation_template_draft01.xsd"
	name="SystemObservation">
		<operationNode id="A3" name="combine Sensors">
			<type>and</type>
		        <parent parentID="A10"/>
		        <negated>true</negated>
		</operationNode>
		<conditionNode id="A4" name="multipleSensors">
			<type>type</type>
			<measureName>measureName</measureName>
			<opType>sensorLowerThan</opType>
			<condValue>
			</condValue>
			<parent parentID="A3" />
		</conditionNode>
		<contextNode id="A5" name="memTest">
			<parent parentID="A4"></parent>
		</contextNode>
		<contextNode id="A6" name="cpuSensor">
			<parent parentID="A4"></parent>
		</contextNode>
		<contextNode id="A7" name ="watchdogSensor">
			<parent parentID="A4"></parent>
		</contextNode>
		<situationNode name="machine_failed" id="A10"/>
</SituationTemplate>
